<?xml version="1.0" encoding="UTF-8"?>
<!--Sample XML file generated by XMLSpy v2006 sp2 U (http://www.altova.com)-->
<Spider xmlns="http://fox.spider.configuration" xmlns:xsi="http://www.w3.org/2001/XMLSchema-instance" xsi:schemaLocation="http://fox.spider.configuration
K:\work\2005\Spider\SpiderConf.xsd" id="NBA_1" name="NBA Spider for 2006-12-05 ~">
	<Table id="GameScore" name="Game Scoreboard">
		<Column type="string" name="Team"/>
		<Column type="int" name="Section1"/>
		<Column type="int" name="Section2"/>
		<Column type="int" name="Section3"/>
		<Column type="int" name="Section4"/>
		<Column type="int" name="Total"/>
	</Table>
	<PageTurners starter="uTurner">
		<UrlWebPageTurner id="uTurner" name="Url">
			<url>http://www.nba.com/games/20070406/DALDEN/boxscore.html</url>
			<url>http://www.nba.com/games/20070406/TORPHI/boxscore.html</url>
			<url>http://www.nba.com/games/20070406/INDCHA/boxscore.html</url>
			<url>http://www.nba.com/games/20070406/MIABOS/boxscore.html</url>
			<url>http://www.nba.com/games/20070406/CLEWAS/boxscore.html</url>
			<url>http://www.nba.com/games/20070406/MINNYK/boxscore.html</url>
		</UrlWebPageTurner>
	</PageTurners>
	<SpiderFlow id="GameScoreFlow" name="Parse Game Score">
		<UrlPattern>http://www.nba.com/games/[0-9]{8}/[A-Z]{6}/boxscore.html</UrlPattern>
		<DocumentParsers>
			<TableDocumentParser id="tParser" table="GameScore" name="GameScore Table Parser">
				<RowContentParserId>xpath</RowContentParserId>
				<Path>/BODY/TABLE[0]/TBODY[0]/TR[0]/TD[0]/DIV[0]/DIV[1]/DIV[0]/DIV[0]/DIV[1]/TABLE[0]</Path>
				<StartRow>1</StartRow>
				<EndRow>3</EndRow>
			</TableDocumentParser>
		</DocumentParsers>
		<RowContentParsers>
			<XPathRowContentParser id="xpath" name="A Parser">
				<Pair>
					<Path>TH[0]</Path>
					<ColumnName>Team</ColumnName>
				</Pair>
				<Pair>
					<Path>TD[0]</Path>
					<ColumnName>Section1</ColumnName>
				</Pair>
				<Pair>
					<Path>TD[1]</Path>
					<ColumnName>Section2</ColumnName>
				</Pair>
				<Pair>
					<Path>TD[2]</Path>
					<ColumnName>Section3</ColumnName>
				</Pair>
				<Pair>
					<Path>TD[3]</Path>
					<ColumnName>Section4</ColumnName>
				</Pair>
				<Pair>
					<Path>TD[8]</Path>
					<ColumnName>Total</ColumnName>
				</Pair>
			</XPathRowContentParser>
		</RowContentParsers>
		<PageTurner>uTurner</PageTurner>
	</SpiderFlow>
</Spider>
